{
  "id": "11111111-1111-4111-8111-111111111111",
  "state": "COMPLETED",
  "spec": {
    "modelArtifact": {
      "uri": "artifact://sha256/aaaaaaaaaaaaaaaaaaaaaaaaaaaaaaaaaaaaaaaaaaaaaaaaaaaaaaaaaaaaaaaa",
      "digest": "sha256:aaaaaaaaaaaaaaaaaaaaaaaaaaaaaaaaaaaaaaaaaaaaaaaaaaaaaaaaaaaaaaaa",
      "size_bytes": 1024,
      "kind": "model"
    },
    "datasetVersion": {
      "uri": "https://catalyst.example/api/v1/dataset-versions/22222222-2222-4222-8222-222222222222",
      "id": "22222222-2222-4222-8222-222222222222",
      "resourceVersion": 2,
      "artifact": {
        "uri": "artifact://sha256/bbbbbbbbbbbbbbbbbbbbbbbbbbbbbbbbbbbbbbbbbbbbbbbbbbbbbbbbbbbbbbbb",
        "digest": "sha256:bbbbbbbbbbbbbbbbbbbbbbbbbbbbbbbbbbbbbbbbbbbbbbbbbbbbbbbbbbbbbbbb",
        "size_bytes": 2048,
        "kind": "dataset"
      }
    },
    "method": "SFT",
    "finetuningType": "LORA",
    "parameters": {
      "epochs": 1,
      "perDeviceBatchSize": 1,
      "gradientAccumulationSteps": 1,
      "learningRate": 0.0002,
      "maxSequenceLength": 512
    }
  },
  "engineBindingId": "binding:llama-factory",
  "engineCapabilityType": "cyrene.yield.training-runtime.v1",
  "activeAttemptId": "33333333-3333-4333-8333-333333333333",
  "attemptCount": 1,
  "outputArtifacts": [
    {
      "kind": "MODEL_ADAPTER",
      "artifact": {
        "uri": "artifact://sha256/cccccccccccccccccccccccccccccccccccccccccccccccccccccccccccccccc",
        "digest": "sha256:cccccccccccccccccccccccccccccccccccccccccccccccccccccccccccccccc",
        "size_bytes": 512,
        "kind": "model"
      },
      "derivedFromDigests": [
        "sha256:aaaaaaaaaaaaaaaaaaaaaaaaaaaaaaaaaaaaaaaaaaaaaaaaaaaaaaaaaaaaaaaa",
        "sha256:bbbbbbbbbbbbbbbbbbbbbbbbbbbbbbbbbbbbbbbbbbbbbbbbbbbbbbbbbbbbbbbb"
      ]
    }
  ],
  "createdAt": "2026-08-31T20:00:00Z",
  "updatedAt": "2026-08-31T20:10:00Z",
  "resourceVersion": 5
}
